"subj_code","condition","desktop_conf","attent_conf","scale_orient","DV_rating","Story","LatentF","explanation","narrow_check","broad_check","age","gender","tech_issues","narrow_correct","broad_correct"
"4ivTnN6SWPhs",1,"1: I confirm","1: I will take it seriously","narrow_left",2,"daisy","visible","Because there was no think green leaves it probably belongs to Daisy A.  Unless the leaves were damaged or pulled off before looking at it.",2,1,56,"1: male",NA,"correct","correct"
"5dTtvw4WaF3j",1,"1: I confirm","1: I will take it seriously","narrow_left",6,"daisy","visible","If you're unsure if there are green leaves its more likely they belong to the group without the green leaves.",2,1,24,"1: male",NA,"correct","correct"
"DOyCsrqryWFm",1,"1: I confirm","1: I will take it seriously","narrow_left",5,"daisy","visible","I was told that the variations of the plant occur equally often. The only distinguishing factor is the prevalence of thick green leaves, which in this scenario I could not assess. Therefore based on the available evidence, I believe it is equally likely a to whether this particular plant belongs to the A or B variety.",2,1,39,"1: male",NA,"correct","correct"
"egcUiPZ11yb4",1,"1: I confirm","1: I will take it seriously","narrow_left",3,"daisy","visible","If one is not sure whether there are green leaves, then they can't have been seen. If they weren't seen, then it is more likely (but not impossible) that they're not present.",2,1,40,"1: male",NA,"correct","correct"
"EiekjjsOlvDQ",1,"1: I confirm","1: I will take it seriously","narrow_left",5,"daisy","visible","I just thought there was a 50-50 chance",2,1,50,"1: male",NA,"correct","correct"
"hhi4epePAKlP",1,"1: I confirm","1: I will take it seriously","narrow_left",5,"daisy","visible","without looking at the leaves, it seems that both varieties of daisy are equally likely to occur and the bloom looks the same so its a 50/50 chance.",2,1,42,"1: male","everything was OK, thank you.","correct","correct"
"izgty0cVvu3I",1,"1: I confirm","1: I will take it seriously","narrow_left",5,"daisy","visible","Both types of flower occur equally often, and I don't know about the status of the distinguishing feature, so I have no information either way.",2,1,37,"1: male","Note that prolific's criteria for a valid attention check include ""They cannot rely on memory recall"". You can discard participants from your analysis based on it if you wish, but you can't reject submissions based on a memory question.","correct","correct"
"M4E7gyoeO03e",1,"1: I confirm","1: I will take it seriously","narrow_left",5,"daisy","visible","Since both look the same, and I do not know exactly if it has thick green leaves or not, it only makes sense that its a 50/50, since they have the same occurrence rate.",2,1,29,"1: male",NA,"correct","correct"
"mXkph3f9a8qn",1,"1: I confirm","1: I will take it seriously","narrow_left",5,"daisy","visible","I had two options. I did not have enough information to comfortably make a choice between the two, so at that moment the likelihood of it being either option was equal.",2,1,38,"1: male","none","correct","correct"
"nF8o8XmaaO4j",1,"1: I confirm","1: I will take it seriously","narrow_left",5,"daisy","visible","If the flowers occur equally and you don't know if it has the leaves or not, then there is a 50% chance of it being type A and a 50% chance of it being type B",2,1,28,"2: female","N/A","correct","correct"
"q5lN06Ya01gm",1,"1: I confirm","1: I will take it seriously","narrow_left",1,"daisy","visible","If the flower was plant B, surely I would have noticed the green leaves. If there are no green leaves then that means the flower is plant A. Also the green leaves were noted as thick. Thick green leaves would be obvious and noticeable. ",2,1,22,"2: female",NA,"correct","correct"
"sbXfQckIWEbK",1,"1: I confirm","1: I will take it seriously","narrow_left",1,"daisy","visible","i think it is more likely to be type a as if it were type b and had thick green leaves, it would have been noticeable upon approach. the uncertainty leads me to believe it is more likely to be absent as the leaves should be distinctive enough to alleviate doubt",2,1,23,"2: female",NA,"correct","correct"
"sQYJOz8reP20",1,"1: I confirm","1: I will take it seriously","narrow_left",5,"daisy","visible","Both are equally likely to grow so both are equally likely to be the one you are looking at",2,1,67,"1: male","None","correct","correct"
"tcMorrHODdl5",1,"1: I confirm","1: I will take it seriously","narrow_left",5,"daisy","visible"," Both types of desert daisies have pearly white blossoms so the specimen I found could belong to either type A or type B.
The differential is the leave and I don't know if the plant has leaves or not, so it could go either way.",2,1,52,"2: female",NA,"correct","correct"
"TuTKVqkA0VH3",1,"1: I confirm","1: I will take it seriously","narrow_left",5,"daisy","visible","As the flowers occur equally often and you don't know if it has thick green leaves or not that means there is a 50:50 chance",2,1,49,"2: female","No problems","correct","correct"
"u5P3uMSHUKnA",1,"1: I confirm","1: I will take it seriously","narrow_left",5,"daisy","visible","I'm presuming both daisies have green leaves, but the type b has thicker ones. If there is no type a to compare with, then it's either a or b.",2,1,69,"2: female","I must have missed the word 'only' in the description of the daisies, at the beginning. I didn't realise that type a only had the white blossom.","correct","correct"
"WcbsV8hSX29u",1,"1: I confirm","1: I will take it seriously","narrow_left",5,"daisy","visible","having little information about the growth of the leaves, the leaves may grow at a different rate, therefore as they were unsure about the leaves it could equally be either of the leaves",2,1,21,"2: female",NA,"correct","correct"
"wPBgRsh4TWB1",1,"1: I confirm","1: I will take it seriously","narrow_left",5,"daisy","visible","It didn't say if the flower had leaves, which means it could have been either Type A or B. Based on the information provided, I felt like either option was equally likely. ",2,1,28,"2: female",NA,"correct","correct"
"Xrd5ExOfmHKC",1,"1: I confirm","1: I will take it seriously","narrow_left",5,"daisy","visible","you don't know if it has leaves means you probably can't see it properly. otherwise you would be sure it did or didn't",2,1,31,"2: female",NA,"correct","correct"
"Y5ZHanjEL5F4",1,"1: I confirm","1: I will take it seriously","narrow_left",5,"daisy","visible","Two choices, equal observable properties -50:50 likelihood",2,1,34,"1: male",NA,"correct","correct"
"YOXJpxAB7T1l",1,"1: I confirm","1: I will take it seriously","narrow_left",2,"daisy","visible","The description to me told me that type A had a white blossom",2,1,30,"1: male",NA,"correct","correct"
"3oFFnmVIfc49",2,"1: I confirm","1: I will take it seriously","narrow_right",5,"daisy","visible","Since both types of desert daisies have the same petals and I wasn't able to see the leaves (and both varieties occur equally), I would assume that the flower was as likely to be Type A as it was to be Type B.",2,1,33,"2: female","Everything looks good!","correct","correct"
"3YbDXLfnkf8c",2,"1: I confirm","1: I will take it seriously","narrow_right",5,"daisy","visible","they both occur equally so it could be either",2,1,59,"1: male",NA,"correct","correct"
"aLAOMfRad0YL",2,"1: I confirm","1: I will take it seriously","narrow_right",5,"daisy","visible","It is impossible to distinguish as both are pearly white and therefore I can't tell which is which without more information. ",2,1,29,"1: male",NA,"correct","correct"
"B7EZ8yceektI",2,"1: I confirm","1: I will take it seriously","narrow_right",6,"daisy","visible","It depends on why you're not sure if it has thick green leaves.  If it's because that part of the plant is obscured then I would give it a 50/50, but then I thought that if it was because it had some leaves and you were unsure if they would be categorised as ""thick/green"" then it would be Type B because A had no leaves at all so it would have to be B regardless.  Now that I'm thinking about it, I think I mistakenly put my rating slightly closer to A when I should have put it closer to B according to this logic lol",2,1,26,"2: female",NA,"correct","correct"
"BWSRXE5Vbv1e",2,"1: I confirm","1: I will take it seriously","narrow_right",5,"daisy","visible","Flowers are both the same, but an even chance that it does or doesn't have leaves.",2,1,35,"1: male",NA,"correct","correct"
"Fbv0yff3luWR",2,"1: I confirm","1: I will take it seriously","narrow_right",5,"daisy","visible","because both plants have white blossom it has 50% chance of having green leaves or not",2,1,33,"2: female",NA,"correct","correct"
"fi8HZK10FzBJ",2,"1: I confirm","1: I will take it seriously","narrow_right",5,"daisy","visible","Both type A and type B have pearly white flowers. The flower you found has pearly white flowers, but you don't know if it has leaves or not. Only type B has leaves. Therefore, it could be either type A or type B.",2,1,50,"2: female",NA,"correct","correct"
"HjaoNBT2JGkz",2,"1: I confirm","1: I will take it seriously","narrow_right",8,"daisy","visible","It definitely has the pearly white blossom. If you don't know whether it has green leaves, that makes me assume you can't see them and therefore they may not be there.",2,1,24,"2: female","N/A","correct","correct"
"iFDOrSH07NL6",2,"1: I confirm","1: I will take it seriously","narrow_right",5,"daisy","visible","There is only one difference between the two... and I don't know if it has that difference so it's 50:50",2,1,21,"2: female",NA,"correct","correct"
"IKF7bmrIfcZX",2,"1: I confirm","1: I will take it seriously","narrow_right",8,"daisy","visible","I think it is more likely to be type A because type B has thick green leaves, so if it was B I think it would be more obvious",2,1,32,"1: male","n/a","correct","correct"
"jdVvF44tYUCz",2,"1: I confirm","1: I will take it seriously","narrow_right",8,"daisy","visible","there was an indecision about whether it had leaves or not",2,1,46,"1: male",NA,"correct","correct"
"kDFvLWRyfmHJ",2,"1: I confirm","1: I will take it seriously","narrow_right",5,"daisy","visible","The two types occur in equal numbers. We don't know whether it has thick green leaves or not, so it could be type A or type B - and equally type A or type B. Hence, with no reason to prefer A over B or vice versa, the only basis upon which to guess which is their distribution, which is 50/50.",2,1,43,"1: male",NA,"correct","correct"
"o6bVv5HCfa0D",2,"1: I confirm","1: I will take it seriously","narrow_right",5,"daisy","visible","they are both growing equally in the dessert so it has to be 50/50",2,1,72,"2: female","none I was aware of","correct","correct"
"rKwoX7q0AOvK",2,"1: I confirm","1: I will take it seriously","narrow_right",5,"daisy","visible","It was mentioned that the likelihood of encountering any of the plants was equally likey. So my answer was based off of that",2,1,26,"1: male","none","correct","correct"
"Rmez2TmNbqbt",2,"1: I confirm","1: I will take it seriously","narrow_right",5,"daisy","visible","Something you don't know cannot form part of your judgement, so my best estimate has to be made just on the flowers, which mean that it could be either flower",2,1,66,"2: female","I don't 'identify' as female, I am a woman","correct","correct"
"s2U0xmMMUfmZ",2,"1: I confirm","1: I will take it seriously","narrow_right",5,"daisy","visible","Because we weren't given any other info about the Desert Daisy, it could be either type A or type B.",2,1,25,"2: female","nothing","correct","correct"
"s4jxXvK1OuHn",2,"1: I confirm","1: I will take it seriously","narrow_right",5,"daisy","visible","There are too many variables to guess at the type of desert daisy. What if one type occurs more frequently than the other? This is not specified in the text. Therefore, I selected 50/50 likelihood as a hypothetical guess.",2,1,27,"2: female","No errors.","correct","correct"
"tGyftCFd8XcQ",2,"1: I confirm","1: I will take it seriously","narrow_right",5,"daisy","visible","if i'm not sure if it had thick dark leaves then i am undecided
",2,1,55,"2: female",NA,"correct","correct"
"v6bUcaHZEyba",2,"1: I confirm","1: I will take it seriously","narrow_right",5,"daisy","visible","The study says both are as likely to occur as each other. The region is correct, and both have pearly white blossoms. If it cannot be verified if there's petals there it's a 50/50 chance. ",2,1,25,"1: male",NA,"correct","correct"
"ysTElg6jdmFd",2,"1: I confirm","1: I will take it seriously","narrow_right",5,"daisy","visible","Well it could be either counldnt it, if you are unsure then its 50/50",2,1,39,"2: female","none","correct","correct"
"zwqyDKwinDWo",2,"1: I confirm","1: I will take it seriously","narrow_right",7,"daisy","visible","They said they were unsure if there was green leaves so it wasn't 100% that it was A ",2,1,28,"1: male","No errors","correct","correct"
"0vIw1hQsxhrR",3,"1: I confirm","1: I will take it seriously","narrow_left",5,"daisy","invisible","they both grow as frequently so you'd assume there are as many type A as there are type B. Therefore the chance of the one you pick either being a or b is 50%",2,3,19,"1: male","none","correct","correct"
"3mkhkpOkzHmb",3,"1: I confirm","1: I will take it seriously","narrow_left",5,"daisy","invisible","i made the choice basd on the facts, that both look the same and maybe even act the same but one is poisnonss, so there is a 50/50 chance it could be either or ",2,3,55,"2: female","i saw no errors in this survey ","correct","correct"
"6a6FaN7Du2qx",3,"1: I confirm","1: I will take it seriously","narrow_left",5,"daisy","invisible","We are told only that they both occur in equal numbers and look alike.  Equal numbers = 50/50.",2,3,47,"1: male",NA,"correct","correct"
"CGNpQvn4Kf7C",3,"1: I confirm","1: I will take it seriously","narrow_left",5,"daisy","invisible","Given they both occur equally I think it is only possible to rate it as a 50/50 chance as there are no outside factors that I can use to tip the probability one way or the other. ",2,3,52,"1: male","I'm not aware of any errors thank you for interesting study.","correct","correct"
"EaFprKK7F6yB",3,"1: I confirm","1: I will take it seriously","narrow_left",5,"daisy","invisible","It said that they were both equally likely and the both had the pearly white blossom. Based of that I must say there is an equal chance of it being either type",2,3,28,"1: male","None","correct","correct"
"eixpFQFu77MC",3,"1: I confirm","1: I will take it seriously","narrow_left",1,"daisy","invisible","it is a even probability and the chances of it being the venomous one is as high as it not being",2,3,24,"2: female",NA,"correct","correct"
"FdtEGC9wkRn6",3,"1: I confirm","1: I will take it seriously","narrow_left",5,"daisy","invisible","The test said that both type of desert daisy occur equally often, so when finding a desert daisy with pearly white blossoms it seems like there is an equal chance of it being type A or type B.",2,3,39,"1: male","Thanks","correct","correct"
"fuAn7SDACzzT",3,"1: I confirm","1: I will take it seriously","narrow_left",5,"daisy","invisible","As both species are the same look and colour there’s no way of telling them apart. It would be too much of a risk to take a chance as it would be 50:50.",2,3,52,"1: male","No problems occurrd","correct","correct"
"KYsPJ5A5ACLt",3,"1: I confirm","1: I will take it seriously","narrow_left",5,"daisy","invisible","the text said both types are equally as likely so i went 50/50 as there is a 50% chance of either ",2,3,24,"1: male",NA,"correct","correct"
"LykFLrL2ekMY",3,"1: I confirm","1: I will take it seriously","narrow_left",5,"daisy","invisible","i put 50/50 because you already told me distribution is equal for both. There was no indication i could tell the difference between the 2 types of daisys",2,3,48,"1: male","none","correct","correct"
"lYzQMMS5CQMt",3,"1: I confirm","1: I will take it seriously","narrow_left",5,"daisy","invisible","As they are visually identical, there is an equal possibility of it being A or B",2,3,68,"1: male","None that I noticed","correct","correct"
"OhHMP7xlQSH5",3,"1: I confirm","1: I will take it seriously","narrow_left",5,"daisy","invisible","It said that they occur equally as often so logic to me dictated an even split",2,3,33,"1: male",NA,"correct","correct"
"ONTV1wIecAJV",3,"1: I confirm","1: I will take it seriously","narrow_left",5,"daisy","invisible","Both types of Desert Daisy appear equally so the Desert Daisy picked has a 50% chance of being Type A or Type B.",2,3,37,"1: male",NA,"correct","correct"
"p8OsknT0FbsY",3,"1: I confirm","1: I will take it seriously","narrow_left",5,"daisy","invisible","Because both types of Desert Daisy have a pearly white blossom and has an equal chance of appearing, there is no way of knowing for sure which type it is, which means there is a 50/50 chance of it being either type.",2,3,28,"1: male",NA,"correct","correct"
"pGY82FHYOcbw",3,"1: I confirm","1: I will take it seriously","narrow_left",5,"daisy","invisible","the previous information said they look the same and have an equal chance of occurring hence i wrote 50/50 chance ",2,3,44,"2: female","no problems I was aware of ","correct","correct"
"SrhuJ4Blym0s",3,"1: I confirm","1: I will take it seriously","narrow_left",5,"daisy","invisible","If both sub types of Desert Daisy occur equally as often and both have a pearly white blossom, then 50/50 chance of seeing either seems likely to me.",2,3,40,"2: female","None.","correct","correct"
"ta3xSNBLoLSi",3,"1: I confirm","1: I will take it seriously","narrow_left",5,"daisy","invisible","well it is a 50% chance it could be either plan therefore odds are 2:1",2,3,47,"2: female",NA,"correct","correct"
"tiXnYEdbQC3W",3,"1: I confirm","1: I will take it seriously","narrow_left",5,"daisy","invisible","It's impossible to tell, as visually they will both look the same.",2,3,41,"2: female",NA,"correct","correct"
"V3b3rAXcbGPc",3,"1: I confirm","1: I will take it seriously","narrow_left",5,"daisy","invisible","I will be at the middle because I cannot point out the motives of the Daisy at face value.",2,3,34,"1: male",NA,"correct","correct"
"VfelQ1l1z7Uh",3,"1: I confirm","1: I will take it seriously","narrow_left",5,"daisy","invisible","Unfortunately, it's impossible to determine whether the Desert Daisy you've come across is Type A or Type B based solely on its pearly white blossom. Both subtypes of the Desert Daisy have a pearly white blossom, so visual inspection alone cannot differentiate them.

To determine if the Desert Daisy you've encountered is Type A or Type B, you would need to examine its stem. If the stem contains a venomous liquid, then it's a Type B Desert Daisy. If there's no venomous liquid present, then it's a Type A Desert Daisy.",2,3,41,"1: male",NA,"correct","correct"
"zmeedjhbqSP5",3,"1: I confirm","1: I will take it seriously","narrow_left",5,"daisy","invisible","I think it is equally likely that the plant could be either safe or harmful, since they appear in equal numbers and you cannot tell them apart just by looking at them.",2,3,38,"1: male",NA,"correct","correct"
"3Bvb4MQRYsJk",4,"1: I confirm","1: I will take it seriously","narrow_right",5,"daisy","invisible","In the description, it mentions that both type appear the same frequency, therefore this particular type could be either.",2,3,43,"1: male","none","correct","correct"
"6BFCPomhtykY",4,"1: I confirm","1: I will take it seriously","narrow_right",5,"daisy","invisible","It said in the original scenario that each Desert Daisy was likely to be found equally, so it was a 50/50 split",2,3,58,"1: male","None","correct","correct"
"C55d6ZWFUq0i",4,"1: I confirm","1: I will take it seriously","narrow_right",5,"daisy","invisible","dont think you can tell the diference between the two of them just by looking at the flowers and as they  both may occur equally, I assume there is a 50/50 chance it will be the poisonous one",2,3,62,"2: female","I didnt notice any","correct","correct"
"CkqbgjcWlBpF",4,"1: I confirm","1: I will take it seriously","narrow_right",5,"daisy","invisible","Both plants have pearly white blossom, and no other distinguishing features, so there is a 50/50 chance of it being poisonous or non-poisonous. ",2,3,71,"2: female","I did not come across any errors.","correct","correct"
"csJF7aWkOiJK",4,"1: I confirm","1: I will take it seriously","narrow_right",5,"daisy","invisible","The both has a Desert Daisy that has a pearly white blossom, but you don't know whether it also has the venomous liquid in its stem or not.",2,3,35,"1: male","None","correct","correct"
"Ehts7wqf6FZh",4,"1: I confirm","1: I will take it seriously","narrow_right",5,"daisy","invisible","It said that they both were equal in numbers and looked the same.",2,3,36,"2: female",NA,"correct","correct"
"hbOIzj53qCKh",4,"1: I confirm","1: I will take it seriously","narrow_right",5,"daisy","invisible","They both look the same. We would need to check the stem fludi but could be dangerous.",2,3,36,"1: male","na","correct","correct"
"jHph1xKFCAyB",4,"1: I confirm","1: I will take it seriously","narrow_right",5,"daisy","invisible","No numbers or specifics were given so it is not practical to tell the probabilities.",2,3,22,"1: male",NA,"correct","correct"
"jItIrtzxtd75",4,"1: I confirm","1: I will take it seriously","narrow_right",5,"daisy","invisible","The description said that when picking a daisy blossom, there was no way of telling if it was type A or type B daisy",2,3,21,"1: male","no errors","correct","correct"
"K30RmV7OYAHs",4,"1: I confirm","1: I will take it seriously","narrow_right",5,"daisy","invisible","Both desert daisy's appear equally as often and both have a pearly white blossom so they look the same. The venom is in the stem, I don't think it is possible to know the difference.",2,3,27,"1: male",NA,"correct","correct"
"lem66waOlLIC",4,"1: I confirm","1: I will take it seriously","narrow_right",5,"daisy","invisible","Although the desart dasy A is new I may not be able to tell by looking at it if it has the venomous stem so thats why I gave it a 50/50 rating.",2,3,58,"1: male","None that I could see.","correct","correct"
"mJmE1blidzFD",4,"1: I confirm","1: I will take it seriously","narrow_right",5,"daisy","invisible","Since both flowers appear to be the same, I have no way of knowing which desert daisy it is.",2,3,40,"1: male",NA,"correct","correct"
"mKlx4eakUoAS",4,"1: I confirm","1: I will take it seriously","narrow_right",5,"daisy","invisible","It said both types are equally as likely to occur, that means type A and B are 50/50 chance, given that one type is venomous and that they are both equally likely to occur, i would say it is equally likely to be venomous",2,3,21,"1: male","none","correct","correct"
"MPRC3rxSR0FT",4,"1: I confirm","1: I will take it seriously","narrow_right",5,"daisy","invisible","They both occur equally as often, they both have pearly white flowers. The only difference is the venom in the stem. You would have to cut it open to tell. Since they are equally occurring then there is a 50% chance it could be either daisy.",2,3,49,"2: female","None.","correct","correct"
"ssaGMOy1DvRq",4,"1: I confirm","1: I will take it seriously","narrow_right",5,"daisy","invisible","Since it was the color that was mentioned and the both flowers have the same colors, i concluded that it could be any of them",2,3,29,"1: male","There was no technical error","correct","correct"
"uKKaOrnJPWlf",4,"1: I confirm","1: I will take it seriously","narrow_right",5,"daisy","invisible","Its just a guess because we dont know enough about where each plant grows, growing conditions etc",2,3,34,"1: male",NA,"correct","correct"
"V5D8tC7MsMcz",4,"1: I confirm","1: I will take it seriously","narrow_right",5,"daisy","invisible","Both have a white blossom",2,3,37,"1: male",NA,"correct","correct"
"VOXUas8TcmA0",4,"1: I confirm","1: I will take it seriously","narrow_right",1,"daisy","invisible","i rated type b because one needs to be careful of the venomous type and should not take chances",2,3,36,"1: male",NA,"correct","correct"
"XpyBt9mCcv9p",4,"1: I confirm","1: I will take it seriously","narrow_right",5,"daisy","invisible","Since it has the same outside look I have no idea if the flower is poisonous or not.",2,3,26,"3: non-binary","None","correct","correct"
"XqQ3AedLt96E",4,"1: I confirm","1: I will take it seriously","narrow_right",5,"daisy","invisible","There was no indication given as to whether it was of the non-venomous variety or of the venomous variety. All of the information that I was given could be applied to either variety, so it was fifty-fifty as to which one it was.",2,3,42,"1: male","N/A","correct","correct"
"ziYNYnYtQkSS",4,"1: I confirm","1: I will take it seriously","narrow_right",5,"daisy","invisible","it is a fifty fifty chance of either plant",2,3,26,"1: male","no errors","correct","correct"
"0uSE55K72H5h",5,"1: I confirm","1: I will take it seriously","narrow_left",5,"stamp","visible","not sure why you can't see the yellow margin but as both occur equally often it is a 50:50 choice",2,1,45,"2: female",NA,"correct","correct"
"1sMR0Jd4Ulgi",5,"1: I confirm","1: I will take it seriously","narrow_left",2,"stamp","visible","The person must have seen a yellow margin if there was one, but I gave this rating in case he missed it.",2,1,60,"1: male",NA,"correct","correct"
"7QgRupQHkCbQ",5,"1: I confirm","1: I will take it seriously","narrow_left",2,"stamp","visible","If you cannot see a yellow boarder on the stamp it is more likely to be stamp a ",2,1,50,"2: female",NA,"correct","correct"
"9eXuOIx2HQqd",5,"1: I confirm","1: I will take it seriously","narrow_left",5,"stamp","visible","I was told that types A and B are equally likely, so therefore selected 50% chance.",2,1,59,"1: male",NA,"correct","correct"
