"subj_code","condition_1","desktop_conf","attent_conf","scale_orient","DV_rating","Scenario","explanation","narrow_check","broad_check","age","gender","tech_issues","narrow_correct","broad_correct"
"dsPZnwCEfDdf",8,"1: I confirm","1: I will take it seriously","narrow_right",5,"featherTooth_noInfo","The sentence gave no indication if he had a golden molar, so the only evidence could apply to either group. ",4,3,21,"1: male",NA,"correct","correct"
"E1gLtDKI0ARZ",8,"1: I confirm","1: I will take it seriously","narrow_right",5,"featherTooth_noInfo","Since the information said that the tribe was half hunters and half fisherman and that both wore head dresses with the only difference being a golden tooth for the fishermen, it is equally likely that the person we ran into could be either. We don't know if we can't see their teeth.",4,3,36,"2: female",NA,"correct","correct"
"elxGFeSVJaLr",8,"1: I confirm","1: I will take it seriously","narrow_right",10,"featherTooth_noInfo","No addition was added to the head dress so I assumed that the person didn't belong to the spear fisherman",4,3,58,"1: male","No errors","correct","correct"
"goBOGJEHgJZU",8,"1: I confirm","1: I will take it seriously","narrow_right",5,"featherTooth_noInfo","The text detailed that either tribe wear feathered headdresses so it could have equally been a member of either without further information on the molar of the person ",4,3,30,"2: female",NA,"correct","correct"
"GTTsVF5QrYTZ",8,"1: I confirm","1: I will take it seriously","narrow_right",5,"featherTooth_noInfo","They both have head dresses but I wasn't told about their gold tooth so I couldn't be sure.",4,3,39,"1: male","None whatsoever. Very enjoyable. I hope the data is useful.","correct","correct"
"i1dG3g8kZqbr",8,"1: I confirm","1: I will take it seriously","narrow_right",5,"featherTooth_noInfo","both fisherman and hunter wore colorful headdress that why the person could belong to either tribe",4,3,33,"1: male",NA,"correct","correct"
"ltMwHUSjaSP9",8,"1: I confirm","1: I will take it seriously","narrow_right",5,"featherTooth_noInfo","Both hunters and fishermen wear feathered headdresses so it 50-50% chance ",4,3,61,"2: female",NA,"correct","correct"
"mp9x3AZM1Kld",8,"1: I confirm","1: I will take it seriously","narrow_right",5,"featherTooth_noInfo","Both are equalyy likely to be the other because they both wear the same colour of headdresses and you cant see the gold tooth on the spear fisher man.",4,3,24,"2: female","I did not experience any errors.","correct","correct"
"otbG3h1Vb6gi",8,"1: I confirm","1: I will take it seriously","narrow_right",5,"featherTooth_noInfo","Since both the hunters and the spear fishermen wear color feathered headdresses, he/she could be from one of the 2 categories, so it's a 50-50 chance. If i see a golden molar tooth as well than I would know that he's a spear fishermen but without knowing if he/she has a golden molar tooth or not, it's a 50-50 bet.",4,3,23,"1: male",NA,"correct","correct"
"PZLDpkmDX2GZ",8,"1: I confirm","1: I will take it seriously","narrow_right",5,"featherTooth_noInfo","both categories wear colourfu headresses, therefore they could belong to either",4,3,62,"1: male",NA,"correct","correct"
"s2RI1yzWN7rD",8,"1: I confirm","1: I will take it seriously","narrow_right",5,"featherTooth_noInfo","Since I only have one piece of information, the coloured headdress, which is shared between both parties, I do not have enough information to assume either way.",4,3,25,"1: male",NA,"correct","correct"
"TGFLqTzg09iO",8,"1: I confirm","1: I will take it seriously","narrow_right",5,"featherTooth_noInfo","As both hunters and spear fishermen wear feathered headdress, there is no way which one is which without supplementary information therefore is equally likely to be either",4,3,42,"1: male","The spelling of ""fishermen"" is wrong on two occasions in the second sentence where should say ""fishermen"" instead of ""fisherman""","correct","correct"
"uEufcniWx87X",8,"1: I confirm","1: I will take it seriously","narrow_right",8,"featherTooth_noInfo","Based on the information provided, it is stated that the members of the Tokolo tribe are divided into two groups: hunters and spear fishermen. Both groups wear colorful feathered headdresses, but only the spear fishermen have a distinguishing feature of a golden molar tooth. Given this context, if I come across a tribesman wearing a colorful feathered headdress, it is reasonable to assume that they may belong to the group of hunters since this is the default category without the additional characteristic of the golden molar tooth. ",4,3,35,"1: male",NA,"correct","correct"
"ujm5KlXsDmgn",8,"1: I confirm","1: I will take it seriously","narrow_right",5,"featherTooth_noInfo","There wasn't enough information for any better odds. I could interpret the fact that the text didn't mention his teeth and therefore assume that it's almost certainly a hunter but again, without other context or info assumption the other way could also be made. Given that it's a survey I guessed that this was exactly the premise that was going to be tested for and so stuck with the rational answer of 50/50",4,3,38,"1: male",NA,"correct","correct"
"uZQ2NzAHU6Yw",8,"1: I confirm","1: I will take it seriously","narrow_right",5,"featherTooth_noInfo","Because both members of the tribe wear headdresses you don't know if they are specifically fisherman until you see if they have a gold tooth. So you need to see them smile first before you make an assumption. ",4,3,28,"1: male","None","correct","correct"
"wCgbd9e4ISdh",8,"1: I confirm","1: I will take it seriously","narrow_right",5,"featherTooth_noInfo","We are told that both wear colourful headwear and without further information we can not distinguish which group they belong to.",4,3,29,"2: female",NA,"correct","correct"
"YJnTsWnLTtQb",8,"1: I confirm","1: I will take it seriously","narrow_right",5,"featherTooth_noInfo","Wearing of the headdress does not distinguish betwene the 2 because the distinguishing feature is not to be found in the headdress",4,3,54,"1: male","I didn't notice any... 

except the first sentence, in the Amazon hunters... I had to read this twice and I think a comma is needed after Amazon","correct","correct"
"ziMc0eZQUOnB",8,"1: I confirm","1: I will take it seriously","narrow_right",5,"featherTooth_noInfo","You said both group wore a headdress and there was no mention of a golden molar tooth.",4,3,30,"2: female","none","correct","correct"
"ZQIjz2dywC2v",8,"1: I confirm","1: I will take it seriously","narrow_right",0,"featherTooth_noInfo","If its just one of them that have it then its definitely a fisherman ",4,3,22,"1: male",NA,"correct","correct"
