"run_id","subj_code","disease1","effects1","scale_orientation","dv_rating","source","explan","age","gender"
217,"fHr7LNpSRtjL","Vilosa","Lian","narrow_right",5,"no_info","The two diseases occur equally often.  The blood test confirmed the patient had high levels of one of the markers, but this marker is common to both diseases - therefore the likelihood the patient has either of the two diseases is 50% (assuming that the marker is also not high in any other unmentioned diseases).  This assumes also that the patient's blood was not tested for the other marker as the information given was silent on that matter.",48,"1: male"
218,"VwxSLHURJWBb","Pylium","Gludon","narrow_left",5,"no_info","As the test didn't show the other possibility, 50-50 seems a correct assumption.",67,"2: female"
219,"yGql0EF7hM2D","Pylium","Gludon","narrow_left",3,"no_info","As there were no abnormal Lian levels it is more likely to be the condition starting with G. However, there is a possibility that the abnormal Lian levels were not picked up in the blood test, therefore cannot be 100% certain that the patient does not have the condition beginning with V.",20,"2: female"
220,"4itVT5OqDE4c","Pylium","Lian","narrow_left",3,"no_info","As the diseases have equal chance of occurring, but liam blood is more likely in one than the other",21,"1: male"
221,"4YoFOzJ49i7o","Pylium","Lian","narrow_left",5,"no_info","Because Pylium and Vilosa occur equally often I rate the likelihood of either Lian or Gludon being about 50%.",74,"2: female"
222,"kBk4uAxIMdVK","Pylium","Lian","narrow_left",5,"no_info","It is because Lian is present in both diseases",39,"2: female"
224,"P9Qyljni4I12","Pylium","Gludon","narrow_right",5,"no_info","I think the patient is equally likely to have either Pylium or Vilosa because they occur equally often and both of them cause abnormal Gludon blood levels. If the test had also been done to assess the Lian blood levels then I think you would be able to identify whether the patient had Pylium or Vilosa. Just on the abnormal Gludon blood level though you can't tell which disease they have and the disease occur equally often so 50/50.",26,"2: female"
227,"rX5HppiSciaD","Vilosa","Gludon","narrow_right",5,"no_info","Because Vilosa causes abnormal levels of Gludon it would be easy to assume this was the cause but Pylium also causes abnormal levels of Gludon along with Lian so it could be this too - would need to test for Lian.",26,"2: female"
228,"EbGYiiin6sWh","Vilosa","Lian","narrow_left",3,"expl_info","Because 250 people out of a thousand have the disease that effects both levels, so it is or likely the patient in question has the disease that just effects one level.",21,"2: female"
229,"QrcJc3NJjuzz","Vilosa","Lian","narrow_right",5,"no_info","Both diseases cause abnormal levels of Lian, and occur at equal frequencies. It is not clear whether the blood test tested for Lian AND Gludol(?) but I assumed it was only for the first of these, and therefore could not be used to differentiate between the two diseases.",78,"1: male"
233,"PPKSfe3gDyfv","Vilosa","Gludon","narrow_right",5,"none","The abnormal gludon levels would suggest the patient has one of the diseases. Since the diseases have equal frequency, the patient has an equal chance of exhibiting either disease.",38,"2: female"
234,"qTuEn71tzHeX","Vilosa","Gludon","narrow_right",2,"none","I choose my selection because there is 1000 people and 250 out of that have bad lain levels that is a quarter of the total so there is 3 quarters chance the patient doesn't have that",24,"1: male"
236,"wKr3hjIKpVz7","Vilosa","Lian","narrow_right",5,"none","Well the fact they are both equally as common made me feel that it was a 50/50 split. Even though you had half the information available to you, it was impossible to tell from the results which one it was.",32,"1: male"
237,"WrXCKKpkwAvG","Vilosa","Lian","narrow_right",6,"none","I think the decision would definitely be close to 50/50, but in the end the disease that has more chance of occurring may be the one that has the two outcomes.",30,"2: female"
239,"dyqPlbugk1rC","Pylium","Gludon","narrow_left",3,"none","One condition can cause 2 different things but the other condition can only cause 1 thing. The chances of it being the latter, therefore, are much greater.",43,"2: female"
250,"NIwSeLJMZk8B","Pylium","Gludon","narrow_left",5,"expl_info","The two mutations occur equally often. Although 1/4 of the people have been confirmed to be with Vilosa, there is still a 50% chance of a chosen individual to be having either of the mutations",34,"1: male"
251,"AnlWYoRsjSWp","Pylium","Gludon","narrow_left",5,"expl_info","It's impossible to predict either way as to which disease the patient has as you can't count on predictability for accuracy.  As no-one can know for sure without the test results, I chose to play it safe at 50/50.",57,"2: female"
252,"luisQ9eVq7Ki","Pylium","Lian","narrow_left",5,"none","You wouldnt be able to tell based off that result, you would have to do another test.",30,"2: female"
253,"mKL22E36u4yV","Pylium","Lian","narrow_left",5,"none","because there is equal possibility of being either varient",29,"1: male"
255,"OnOQLvNtPPOf","Vilosa","Lian","narrow_left",3,"expl_info","Because the occurence of gludon being present in the blood test is less likely.",60,"2: female"
