VYFQP3llw97b;2;narrow_right;probability;1;35;2: female;Not that i was aware of;0;They don't know about the Lian yet only Gludon and both mutations cause abnormal gludon levels and both mutations are equally likely in general population so i belive it is equal chance of being either mutation;1;;;;;
Ef0NjOhI6Xvi;2;narrow_right;probability;1;45;2: female;NA;0;People who have Mut-Taw4 are the same percentage of the population as people who have Mut Bic2 so it is equally likely that the patient might have both;1;;;;;
uwUc4goo3jCs;2;narrow_right;probability;1;60;1: male;no errors;0;Both mutations are equally likely. The information given doesn't give any clues as to which mutation the patient has.;1;;;;;
LefgPgcrKdLv;2;narrow_right;probability;1;26;1: male;NA;0;As only the Gludon levels are effected (as far as we know), it is equally likely that either mutation is possible. Until we know more, we can't determine which they may have.;1;;;;;
uj8EYQ7Iq7E8;2;narrow_right;probability;1;26;1: male;NA;0;Because we don't know the Lian blood levels of the patient, we cannot deduce which mutation they have, so it's equally likely ;1;;;;;
ttCEMNLVVN8k;2;narrow_right;probability;1;34;2: female;NA;0;Both options are equally likely, as the Gian mutation is an aspect of both.;1;;;;;
euY4hIjxQSmo;2;narrow_right;probability;1;31;1: male;NA;0;I believe as there is an equal possibility of either condition being the cause, it was right to vote down the middle ;1;;;;;
98hjkkVorXVV;2;narrow_right;probability;1;58;1: male;No errors, only in my brain, as it back fired trying to understand muc bac gludon lians .. :);0;They both cause gludon problems but only one varient causes loan problems, to have gludon problems is expected in both mutations ;1;;;;;
DZu62s39oPMx;2;narrow_right;probability;1;58;2: female;NA;1;they are likely as each other but MUT-BIC2 has created the levels, this is due to the number of people ;;1;;;;
FgpJKFBMNBh2;2;narrow_right;probability;1;44;1: male;NA;0;both genes affect the Gludon levels but only one of them affects the Lian levels, therefore t could be either yet as we dont know if lian levels are abnormal;1;;;;;
a9SWZ2xqy9ya;2;narrow_right;probability;1;26;2: female;none;0;If they have only had their gludon levels tested then we cannot know which one they have. And as they both have the same probability, I put it halfway between both.;1;;;;;
QtPeGI2bSPUM;2;narrow_right;probability;1;27;2: female;No issues;0;Both mutations cause abnormal Gludon, but only one causes abnormal Lian which we don't know the result of yet. As we don't know if Lian is normal or abnormal, the possibility is equal between the two mutations.;1;;;;;
h2Ypgp2MMKgz;2;narrow_right;probability;3;27;2: female;No errors;0;My rating was made because it sounds as though the person has both. ;;1;;;;
pnSkRoW2wiKi;2;narrow_right;probability;2;31;2: female;NA;0;as the gludon blood levels were abnormal it is just as likely that it could be either mutation;1;;;;;
KAR0ayuGyEXQ;2;narrow_right;probability;1;50;1: male;No errors.;0;The mutations appear in equal percentages of the population, so the person stated has an equal chance of having either of the mutations.;1;;;;;
FVl5v2JyTBzW;2;narrow_right;probability;2;38;1: male;n/a;0;Information said that both types were equally likely found in people.;1;;;;;
zQ229tRTgfvm;2;narrow_right;probability;2;58;1: male;NA;0;Since both are equally likely, unless there is more info about Lian, then we cannot deduce further;1;;;;;
DTMI5wSbn8pq;2;narrow_right;probability;1;25;2: female;NA;-1;Because both Mut-Taw4 and Mut-Bic2 are most likely to be the course give they're both equally common.;;1;;;;
rknfiNo740Be;2;narrow_right;probability;1;65;1: male;NA;0;we were told there is an equal probability of Taw 4 and Bic 2 being the cause.;1;;;;;
JvCbEtR5QfOi;2;narrow_right;probability;1;51;2: female;n/a;0;It seems impossible to tell without knowing Lian levels however, both are equally prevelant in the population;1;;;;;
qJGpdxoCH6Sj;2;narrow_right;probability;1;29;2: female;None;-3;It was clear that the patient had the first mutation. It is highly unlikely that they would have the other one ;;1;;;;
WzQ9zSVNpAj0;2;narrow_right;probability;1;29;1: male;NA;0;It was stated previously that a person with the mutagion could equally have either one, so I went for the middle one ;1;;;;;
yjlpLkcZnIL1;2;narrow_right;probability;2;32;1: male;none;2;Based on the given information, Patient #53 has either Mut-Bic2 or Mut-Taw4. It is known that Mut-Bic2 causes abnormal Gludon blood levels, which has already been confirmed in the patient. However, the presence of abnormal Lian blood levels is still unknown. Mut-Taw4, on the other hand, causes both abnormal Gludon and abnormal Lian blood levels.;;1;;;;
DEWxOMvJ38sR;2;narrow_right;probability;1;48;2: female;No errors;0;I chose equally likely as Mut-Taw4 and Mut-Bic2 are equally prevalent. In the test example it used Lian blood levels as the indicator and Lian blood levels are only found in one mutation. Abnormal Gludon levels are found in both mutations and therefore that was the reasoning behing the selection.;1;;;;;
4ozTW1ZnipBh;2;narrow_right;probability;1;36;1: male;NA;0;Since we don't know about lian, we cannot rule out either one. And there is an equal chance of both occuring. ;1;;;;;
GeSdE4etdLmS;2;narrow_right;probability;1;59;2: female;NA;0;It is possible for the patient to get both mutations ;;1;;;;
ElrRmBu8XMNP;2;narrow_right;probability;1;67;1: male;NA;0;As you have not testes  for lien levels it is right to assume that both abnormalities could still be the cause.  ;1;;;;;
NOfdqVqA5hyv;2;narrow_right;probability;1;30;1: male;NA;-2;Well it is unclear yet if patient #53 has abnormal levels of lian thats why i was slightly leaning towards mut2;;1;;;;
Ty4jJSCXEEuW;2;narrow_right;probability;2;37;2: female;none;0;because they are equally likely to occur in a person;1;;;;;
3kUTo1wSuxEf;2;narrow_right;probability;1;49;1: male;NA;0;due to the prevalence of the gene occurring equally within the population and that gludon levels occur in both gene mutations;1;;;;;
QbvYEYSBS73O;2;narrow_right;probability;1;43;2: female;none;0;both are likely to cause the abnormal gludon blood levels so its equally likely to be either if the patient has abnormal levels there;1;;;;;
H1OfNCXLdBIE;2;narrow_right;probability;1;40;1: male;none;0;It could be either mutation from the information I have been given;1;;;;;
doqEtxUjwMLu;2;narrow_right;probability;3;30;1: male;NA;0;The only difference is the lian levels and both are equally likely, so until we know the lian levels it is not possible to guess which one it could be . ;1;;;;;
qIzahyR4jjoG;2;narrow_right;probability;1;51;1: male;NA;0;As I understand it, an equal number of people have the relevant levels.;1;;;;;
OpLaTMxWzirm;2;narrow_right;probability;1;32;1: male;no errors;0;Because both occurs simultaneously;;1;;;;
LOGep8V95HU4;2;narrow_right;probability;1;28;2: female;NA;-4;"It's highly likely that the patient will have both but it isn't an absolute guarantee that they will have both. That's why I chose I rating just below ""Definitely both"".";;1;;;;
kZjWRyEgZ6G4;2;narrow_right;probability;1;66;1: male;none;0;we were told the same number of people had each condition therefore it is  an equal chance of having either of them;1;;;;;
VwBXCCPu3jRZ;2;narrow_right;probability;2;33;2: female;none;0;Gludon levels do not give me information on Lian levels, which would determine only one of the mutations. Since both mutations are equally likely, the changes for each mutation are also equally likely;1;;;;;
MF7uidvYJTS7;2;narrow_right;probability;1;36;1: male;I didn't identify any errors.;0;Since the prevalence of both mut-taw and mut-bic is equally likely to occur in a given population and the patient, patient #53, already has abnormal gludon levels, I believe that either mut-taw or mut-bic is equally likely to be present in patient 53.;1;;;;;
7yglU56WnIdg;2;narrow_right;probability;1;31;1: male;NA;-3;"Mut Bic 2 causes abnormal Gludon levels but it was unclear that the Lian levels had raises so based on this information and the evidence provided it is likelier to be Mut Bic 2 which just results in raised Gludon levels
";;1;;;;
xXUM7m1oPzr7;2;narrow_right;probability;1;34;1: male;NA;0;Only when we know the Lian level will we be able to discern which case is appropriate.;1;;;;;
wslyMe5rtOkn;2;narrow_right;probability;3;73;1: male;NA;-3;Given because of the definition given in the explanation of the difference between Bic and taw;;1;;;;
fEpuBGjVI8da;2;narrow_right;probability;1;48;2: female;no issues;-1;They definitely have elevated Gludon levels there is a 5% chance they have the other but not tested yet.;;;;1;;
4vn92b0athp7;2;narrow_right;probability;1;27;4: prefer not to say;NA;0;Lian levels are equally likely to be in the population thus there is 50/50 chance patient 53 could have it.;1;;;;;
hx9LvczdR43C;2;narrow_right;probability;1;45;1: male;None that I could discern.;0;It was stated that Mut-Taw4 and Mut-Bic2 are equally likely to occur in a person. Since the previous question told me that the person in question had high Gludon levels, there is an equal chance of this being attributable to either the Taw4 OR the Bic2 variation as Lian levels were unknown.;1;;;;;
Q3FhZnhFd4tr;2;narrow_right;probability;1;29;2: female;N/A;0;Because the likelihood seems to be equal;1;;;;;
eKHP0loSdCrO;2;narrow_right;probability;1;31;2: female;NA;0;The outcome is unknown so the chances of having that as well is 50%.;1;;;;;
2oLxvKvyscvP;2;narrow_right;probability;2;46;1: male;NA;0;because both mut are equally likely to occur in a person;1;;;;;
4vZv6eeMcygz;2;narrow_right;probability;2;34;1: male;no any issues ;-3;it will definitely reduce the life expectancy ;;1;;;;
BSUGj5atfVM6;2;narrow_right;probability;2;22;1: male;none;0;Both are equally likely to occur in a person and therefore without knowing if Lian blood levels are raised. It is equally likely that either genetic mutation could be the cause of this.;1;;;;;
hTiSuiOMhVR7;2;narrow_right;probability;3;46;2: female;NA;0;both gludon and lian blood levels cause problems;;1;;;;
aisgaoy5oarN;2;narrow_right;probability;1;22;1: male;NA;-2;I chose that option more as there's still a chance that the patient could have an increase in lian levels.;;1;;;;
v0DfvUYXQ5WH;2;narrow_right;probability;1;61;1: male;NA;0;Both mutations are equally likely to affect a subject's Gludon so can not say which one it is until we know the Lian levels.;1;;;;;
6Wjq0laKkPf6;2;narrow_right;probability;1;37;1: male;NA;0;They have the underlying issue that is constant for both mutations and both mutations are equally likely to occur;1;;;;;
kX5FugFftzjP;2;narrow_right;probability;1;28;1: male;Non;0;They are both equally likely to occure;1;;;;;
YKolSi03N7u3;2;narrow_right;probability;2;45;2: female;NA;0;I just assesed the situation and thought that was the most likely outcome.;;1;;;;
uBE3ux3Mr8sY;2;narrow_right;probability;2;67;1: male;None;0;At the moment we do not know about Ludon levels in the patient so each mutation is equally likely to be the cause;1;;;;;
NIl2g5O2Nqnx;2;narrow_right;probability;2;22;2: female;All good :);0;As it previously stated that the effects of each of these are equal;1;;;;;
vnmB7JtNfeqk;2;narrow_right;probability;1;39;1: male;No issues with the study, easy to complete, thank you very much.;0;"I gave the rating of ""both equally likely"" because of the information from the study of 200 people. It showed that the Taw4 and Bic2 gene mutation are equally likely to occur. Both are equally likely to cause the abnormal Gludon levels in patient 53. ";1;;;;;
2H24WDPZq6jd;2;narrow_right;probability;1;41;2: female;NA;0;Its it known that either has an equal chance if being likely to occur in a person;1;;;;;
FYC4eHRUEEo1;2;narrow_right;probability;1;46;1: male;No errors;0;They either have MUT-TAW or MUT-BIC, both are equally prevalent so I put the odds as equal ;1;;;;;
gCrEXXL8Ptbd;2;narrow_right;probability;1;43;2: female;NA;0;Both cause the condition we know the patient definitely has so either one is likely to have given to her;1;;;;;
wX4gAfRkDFhm;2;narrow_right;probability;1;24;1: male;No errors.;0;The info I was provided said that both mutations are equally likely, and they both affect that Gludon blood level. Thus, either one should be equally likely in this case, since both are equally common and would explain the condition.;1;;;;;
l2Ctnu73djIN;2;narrow_right;probability;3;41;1: male;NA;0;"We don;t know enough to determine which is the cause";1;;;;;
ujVE5Npuahez;2;narrow_right;probability;1;57;1: male;NA;0;Only by measuring the lian levels will we know what gene mutation this is, as only Mut-taw4 has abnormal lian levels;1;;;;;
qAroplBRGVFX;2;narrow_right;probability;1;41;1: male;NA;0;Abnormal levels of gludon in the blood is a symptom of both Mut-Taw4 and Mut-Bic2. As both of these are equally likely to occur in a person there is an equal chance that it could be either of the 2 mutations.;1;;;;;
jWgLDRmv1IMg;2;narrow_right;probability;2;31;1: male;No errors;0;Mut-Taw4 and Mut-Bic2 are equally likely to occur in a person that is afflicted and therefore it is we don't know what the patient has until he has been tested.;1;;;;;
7EFpZAOY6k2g;2;narrow_right;probability;1;31;1: male;NA;0;Both mutations are equally likely to occur and the symptom the patient was tested for is caused by both mutations.;1;;;;;
HfMDhAZVSZgs;2;narrow_right;probability;1;51;1: male;NA;-4;I made my decision based on what we've found already on gludon;;1;;;;
4ks3MuPDlNye;2;narrow_right;probability;1;50;1: male;I found no errors as far as I recall.;-1;I based my prediction upon the facts as presented earlier and that the Mut Bic 2 did not see the Lian blood level effect compared to Mut Taw.;;1;;;;
FU96KzvZLCiP;2;narrow_right;probability;1;61;1: male;no errors all good :-);0;as they both can occur equally it isnt possible to tell hence my decision;1;;;;;
NKZSCr4qikjn;2;narrow_right;probability;1;36;2: female;NA;3;No indication of Liam levels, yet. Makes statistical sense to go with the one already found. ;;1;;;;
XVf6M7r1NIEj;2;narrow_right;probability;3;34;1: male;NA;3;Whilst more testing would give them a direct answer, I think there's a reasonable chance to think that the participant is suffering with one over the other given that they are both equally distributed between all the participants and a process of elimination could be done to see for sure. ;;1;;;;
rxwDrAFhFqc3;2;narrow_right;probability;1;36;1: male;no errors, great survey;-1;because it was close but just felt  the other felt just slightly that one of them could have caused it over the other;;1;;;;
eAUjdHUgRytK;2;narrow_right;probability;2;45;1: male;NA;0;Gliding occurs in both mutations, so equally likely;1;;;;;
xWKZSgJsXbse;2;narrow_right;probability;2;61;2: female;N/A;0;I made my rating to the best of my understanding.;;1;;;;
Who7eO0an71l;2;narrow_right;probability;2;51;1: male;none;0;I believe each scenario to be likely;;1;;;;
RXaBWCtVfTnf;2;narrow_right;probability;1;52;1: male;no problems;0;Mut-Taw4 and Mut-Bic2 are equally likely to appear in a person;1;;;;;
WaeFwkJEvjLb;2;narrow_right;probability;2;43;1: male;NA;1;not sure;;1;;;;
fNyoMFxNDjys;2;narrow_right;probability;1;46;2: female;No errors. The survey was intersting;0;Mut-Taw4 and Mut-Bic2 are noth equally likely to occur in a person so without testing the Lian blood levels it could be either.;1;;;;;
iTNgIAOdQpRR;2;narrow_right;probability;1;25;2: female;NA;0;We only know they have abnormal gludon levels. Therefore they could have either alterations.;1;;;;;
0Eej47ooxiqO;2;narrow_right;probability;1;26;1: male;No errors.;0;Without confirmation of Lian being present, and both gene mutations being equally likely, you'd be making an assumption leaning into either of the options.;1;;;;;
2cvNcQRfARcm;2;narrow_right;probability;1;32;1: male;NA;0;Both cases cause increased gludon levels, but the only way to know the difference is to know the Lian levels. If those levels have not been tested yet, then there is no way of knowing.;1;;;;;
stX7ODhtDwkC;2;narrow_right;probability;2;34;1: male;none;0;not enough info given, could be either;1;;;;;
FGnbuAH9hfnY;2;narrow_right;probability;1;47;2: female;none;0;Both mutations have equal standing so people have equal chance of getting it;1;;;;;
T635Z9yJIkyO;2;narrow_right;probability;1;71;1: male;NA;-3;My answer is the most statistically likely outcome.;;1;;;;
UfEwwygkhRHG;2;narrow_right;probability;1;26;1: male;NA;0;Theres not enough information to know for sure, but i msure it said they are both equally likely;1;;;;;
lZvuE3wJi2XV;2;narrow_right;probability;1;43;1: male;NA;0;The distribution of people getting the mutations are equal, so therefore if this patient has Mut_Bic2, then they can equally have Mut-Taw4;1;;;;;
3yXpG361UpXT;2;narrow_right;probability;1;73;1: male;NA;0;if they are both equally likely to occur singly or together until tested you have to assume it coulbe either scenario;1;;;;;
atGTpsVp6vkP;2;narrow_right;probability;2;40;1: male;NA;-5;It was stated that their blood levels were affected by mut-bic2 so therefore they defiantly have that.;;1;;;;
G1Mjxu5pTLDG;2;narrow_right;probability;1;30;1: male;NA;0;We know that the patient has abnormal Gludon but not yet if they have Lian. Therefore, both mutations are still possible since they both have Gludon abnormalities.;1;;;;;
b4NR4iCO55Fp;2;narrow_right;probability;1;36;2: female;NA;0;Gludon is affected with both mutations so could be either equally i think;1;;;;;
hIYrqavaIKnQ;2;narrow_right;probability;1;45;1: male;No issues/errors - all good. ;3;As we do not know his lian levels I went for Mut-Bic2 as it always causes abnormal Gludon blood levels.;;1;;;;
OsxDhneuEXiF;2;narrow_right;probability;1;48;1: male;NA;0;It was described as the chances of having both are equal in the pre text.;1;;;;;
0BUHBIVJMbxH;2;narrow_right;probability;1;54;1: male;none;0;People are equally likely to have either mutation, therefore that's why I gave the rating of 50%;1;;;;;
JQAfKT4Yn8wY;2;narrow_right;probability;1;27;1: male;NA;0;As we haven't investigated both levels yet, it's important to acknowledge that both mutations are as likely with all the information that we have. ;1;;;;;
i45Cc4qUA0Ki;2;narrow_right;probability;1;36;1: male;NA;0;Both are equally likely to be diagnosed with either because the patient hasn't been tested yet for Lian.;1;;;;;
J7fYJ9WCyASo;2;narrow_right;probability;1;58;2: female;None.;0;"Since both mutations lead to abnormal Gludon levels both could be responsible. Only a test for Tian levels 
 would identify which gene was responsible.";1;;;;;
4CNuXmtzbR3x;2;narrow_right;probability;1;32;1: male;NA;0;The first pages explained that someone is equally likely to have either condition, therefore if they have raised gludon levels, the possibility of either remains 50%;1;;;;;
ngxtUnxCqlnc;2;narrow_right;probability;1;30;2: female;None;0;We know that the patient has one of the two mutations but it isn't possible to know which one yet because the Lian levels will show whether it is the other mut-TAW4 mutation. As both are equally likely to occur in the population neither is more likely than the other.;1;;;;;
6usNkqXRxXLl;2;narrow_right;probability;1;63;2: female;None;0;Because from memory you said that it was equally likely and that there is only a 5% chance, so it's low.;;1;;;;
xCiOkshavgqC;2;narrow_right;probability;1;27;2: female;i did not see any errors;0;well until we're certain of Lian levels, it is an equal chance of being both.;1;;;;;
8nxOBdj7M34q;2;narrow_right;probability;1;73;1: male;None!;0;Both are equally likely to occur in people and both cause abnormal Gludon levels;1;;;;;
zAUYJgd4m2aO;2;narrow_right;probability;1;40;2: female;NA;0;We dont know whether he has them so he is equally likely to have and to have not;1;;;;;
FAByJwdWnEO5;2;narrow_right;probability;1;53;1: male;No errors;0;The patient has abnormal gludon blood levels so it a high possibility that they also have high Lian blood levels as the statistics show the probability of having Mut-taw4 or Mut-bic2 are the same so if half the signs are there, then the probability of having the other are 50/50 so that is the reason I chose what I did;1;;;;;
FMiH7sZQBnpY;2;narrow_right;probability;1;23;2: female;no issues ;0;we are currently unsure about the ludon levels so they are both equally as likely.;1;;;;;
8IN9U4LgGLPe;2;narrow_right;probability;1;21;3: non-binary;NA;0;Because it is most likely that if he has one of the genetic mutations he also has the other one, and therefore it is equally likely that it is being caused by either of them rather than one of them.;1;;;;;
eyc0WcirTi33;2;narrow_right;probability;1;24;1: male;none;0;Because the number of people that may be suffering from it may have both at a time.;;1;;;;
d5a2RGTrA8dW;2;narrow_right;probability;1;29;1: male;NA;0;Both options are equally likely to have produced the measured outcome, so it is 50/50 as to which will be causing the unmeasured outcome;1;;;;;
AtnjZMaI5ONO;2;narrow_right;probability;1;50;2: female;NA;5;Well he has abnormal Gludon levels and there is still a chance he has abnormal lian levels so meant to click both as likely;1;;;;;
0okHpoPMYvfD;2;narrow_right;probability;1;34;2: female;NA;0;The patient has an equal chance of having either, therefore, an equal chance of Lian;1;;;;;
LgbNrornZDfT;5;narrow_left;satisfaction_is;2;40;2: female;No errors;0;"It is stated that these 2 always occur equally
";1;;;;;
lMJ6dnktWA2I;5;narrow_left;satisfaction_is;1;51;1: male;NA;0;It is likely that the patient has both conditions as they are equally likely to be present in a patient that has one or the other;1;;;;;
EijPuDoel2I5;5;narrow_left;satisfaction_is;1;55;2: female;none;0;it said that both were equally likely in the population so it could have been either;1;;;;;
kZLBQQF7jMZm;5;narrow_left;satisfaction_is;1;27;2: female;NA;0;The two conditions occur at the same rate and both affect the gludon levels so it is equally likely that either is the cause.;1;;;;;
Ba9qreNqeAG6;5;narrow_left;satisfaction_is;2;35;2: female;non;0;the patient is equally affected;;1;;;;
atzMLMeqfrv7;5;narrow_left;satisfaction_is;1;54;2: female;NA;0;Because both are equally prevalent;1;;;;;
HfwwUDNycdXb;5;narrow_left;satisfaction_is;1;55;2: female;NA;0;They could have just one or both so it's equal;;1;;;;
6TPotfXxZ3ec;5;narrow_left;satisfaction_is;1;31;2: female;NA;-5;both would be found simaltaneously;;1;;;;
jwSa5MVTm9a7;5;narrow_left;satisfaction_is;1;25;2: female;No errors ;0;They are both equally likely and both cannot be discounted at this stage until subsequent testing has ruled out Mut-Taw4;1;;;;;
rvR49QXMM3sC;5;narrow_left;satisfaction_is;1;64;2: female;I could not see any errors;-1;I think it would be better to just have the one condition than both, therefore I have said that it would be better to have this than both, although obviously better to have neither.  ;;;1;;;
UppKQUud5dpR;5;narrow_left;satisfaction_is;1;32;2: female;NA;0;The patient is equally likely to have either mutation given our current knowledge that they have increased levels of the thing that results from both mutations, and that the mutations have equal rates of occurrence.;1;;;;;
PKLKFVvf0KYC;5;narrow_left;satisfaction_is;1;59;1: male;Not applicable;-4;The patient has the blood mutation that is common to both of the possible mutations but we can only be certain at this time that they have the first mutation with a possibility that they also have the second.;1;;;;;
CZDpxTwT0j8X;5;narrow_left;satisfaction_is;1;53;2: female;NA;0;Without the second test there is no way of knowing which it is. The original write up said that equal numbers of the general population have each so it's 50:50 at this point.;1;;;;;
IwwKPawtYQXp;5;narrow_left;satisfaction_is;1;39;1: male;None.;0;I assume that the probability of having either mutation is equal.;1;;;;;
1d3PensDdfyY;5;narrow_left;satisfaction_is;1;50;1: male;N/A;0;The two mutations have the same prevalance regardless of the level of Lian. As we don't know the Lian measurement then both mutations are equally likely.;1;;;;;
0S3ILCX7XU7f;5;narrow_left;satisfaction_is;1;50;1: male;NA;-3;If I remember correctly, 2 and 4 have 50/50 chance in everyone, and 4 only has 5%;;;;1;;
klaEeYxrhh6N;5;narrow_left;satisfaction_is;1;33;1: male;NA;0;both can occur equally so it is not possible to confirm until lian levels have been checked;1;;;;;
2Xry0DwfFeYW;5;narrow_left;satisfaction_is;1;40;1: male;NA;0;both are equally likely and both are equally likey to affect the level of gluon in the bloood;1;;;;;
uBZTKIeRpxvp;5;narrow_left;satisfaction_is;1;30;1: male;I thought that the comprehension check was unfair as all the questions were on a different page to the  possible answers.;-3;"The patient definitely had either one of Mut-Bic2 or Mut-Taw4.

Only 5% of people were found to have abnormal Lian blood levels, so I thought it was more likely that the patient had Mut-Bic2 than Mut-Taw4.";;;;1;;
tp3lCMo9nVwc;5;narrow_left;satisfaction_is;1;38;1: male;i didnt notice errors;-5;the patient has been found yo have mut-bic2 which leads to abnormal gludon blood level;;1;;;;
HufKFc7lFzTX;5;narrow_left;satisfaction_is;1;36;2: female;none;0;They gene mutations are equally likely and they both cause the abnormal bood level so as the patient has this abnormal blood level it is equally likely it could be either mutation causing it. ;1;;;;;
n8BVpnJuBkWo;5;narrow_left;satisfaction_is;1;34;2: female;NA;0;They are equally likely to occur and they both produce the known symptom so without further testing it could be either one.;1;;;;;
D8r97KQ17v4U;5;narrow_left;satisfaction_is;1;57;2: female;NA;3;It was believed that if you had one of the mutations you presumable have the other too;;1;;;;
