RDCZSR8hcyTA;5;narrow_left;satisfaction_is;1;52;1: male;NA;0;Both are equally prevalent so with only knowledge that the patient's gludon was affected, it is equally likely to be either outcome;1;;;;;
y4yG0tTIJnKn;5;narrow_left;satisfaction_is;1;37;1: male;NA;0;could be some 'monty hall' trick going on but it seemed like in terms of prior prob and conditional on high gludon,  neither provided any reason to differentiate between the causes;1;;;;;
uILi0sIVqCAM;5;narrow_left;satisfaction_is;1;43;1: male;NA;-3;Since the patient definitely has Mut-Bic2. However, the patient may not have Mut-Taw4.;;1;;;;
iPqj7xxO95BK;5;narrow_left;satisfaction_is;1;44;2: female;NA;-1;as only 10 in 200 have abnormal lian bloodlevels its more slightly likely to be mut-bic2 but you cant say for certain;;;;1;;
TfaVuL0vLjoY;5;narrow_left;satisfaction_is;1;50;2: female;None.;0;i think it is equally likely that the patient has either of the mutations.;1;;;;;
aYi2thhZ3jUZ;5;narrow_left;satisfaction_is;1;62;1: male;-;0;At this point the patient could have both mutations or just the first one only;;1;;;;
U98bRcKY8e4L;5;narrow_left;satisfaction_is;2;31;1: male;n/a;3;I believe this to be the case;;1;;;;
nrX67XP8HHqx;5;narrow_left;satisfaction_is;1;27;1: male;All good, thanks!;0;They seem equal due to the fact that population affected is the same.;1;;;;;
F5UjDTptLrBy;5;narrow_left;satisfaction_is;1;39;2: female;NA;-3;my way of thinking is it was definitely possible to say they have a gludon disorder because that has been confirmed abnormal. the other one is not known. seeing as the other one is not known we cannot 100% go all the way to gludon but we also cannot go into the lido either as they may not have it;;1;;;;
axZ2HTkQrU1x;5;narrow_left;satisfaction_is;1;62;2: female;None, all straightforward.;0;The study said that patients were equally likely to have either mutation so I guessed that there was an equal chance of Mut Bic and Mut Taw - since they tested for positive Gludon but until you test Lidon?  You don't know which one they have.;1;;;;;
usfCFIleEnfB;5;narrow_left;satisfaction_is;2;29;2: female;NA;0;They could easily have either from the details provided so far;1;;;;;
MBiz3fjOl3Wz;5;narrow_left;satisfaction_is;1;30;1: male;NA;0;The two mutations appear at the same rate, so just because we have confirmed one and not the other, doesn't mean it is more likely to be the first one. Only after testing for the second mutation can this be confirmed.;1;;;;;
TaHJGYDNyDNr;5;narrow_left;satisfaction_is;1;48;1: male;NA;0;Both mutations cause the abnormality at the same rate.;1;;;;;
ypPPinwJT4pO;5;narrow_left;satisfaction_is;1;47;1: male;NA;2;We don't know for sure if the patient has lian problems but there are abnormal findings so I feel its possibly headed to lian problems but not definite;;1;;;;
SmzncGKfgueX;5;narrow_left;satisfaction_is;1;64;1: male;None;0;"Both mutations cause abnormal Gludon levels and therefore either of them could have caused the symptom in the patient. There is no information yet about the Lian blood levels therefore we can make no accurate judgement on whether the mutation is Mut-Bic2 or Mut-Taw4. 
Given current information both mutations are equally possible.";1;;;;;
OThEJuyZZg5p;5;narrow_left;satisfaction_is;1;46;1: male;NA;-5;"The question asked what was the most satisfying answer for the increased Gludon, which was the first mutation.

In reality there is an equal change they also have the second mutation, but this would not impact the Gludon only Lian";1;;1;;;
asUX2JNmXnHM;5;narrow_left;satisfaction_is;1;25;1: male;NA;-5;Only higher levels of Gludon was confirmed in the patient which is attributed to Mut-Bic2. There is uncertainty about the Lian levels which is attributed to Mut-Taw4. Thus, the patient definitely has a Mut-Bic2 mutation and the Mut-Taw4 is yet to be confirmed;;1;;;;
PteHi2v9OcAw;5;narrow_left;satisfaction_is;1;46;1: male;NA;0;until there is a definitive answer, its difficult to saw which is likely and you don't want togive the wrong impression to the patient;;1;;;;
ivhfKceTP3UK;5;narrow_left;satisfaction_is;1;34;1: male;Satisfactory;-5;It shows the person is already confirmed with a change in Gludon blood level is it is absolutely normal my selection is accurate ;;1;;;;
Q9h4HaPwJFHi;5;narrow_left;satisfaction_is;1;48;1: male;NA;5;i went by the already diagnosed type the patient had been screened for;;1;;;;
inQRL68QJ9FX;5;narrow_left;satisfaction_is;1;43;2: female;NA;0;With the information currently available, eiher mutation is just as likely. More information is needed to decide which mutation the patient has.;1;;;;;
uHIIcGAFagF4;5;narrow_left;satisfaction_is;1;56;2: female;NA;-3;I think it would be unlikely for a person to have both of the conditions but not impossible so I chose 30%;;1;;;;
B6Wtb7Xx9KWb;5;narrow_left;satisfaction_is;1;27;2: female;N/A;0;There is no reason to believe one is more likely than the other when we do not know the patients Lian levels;1;;;;;
EWuRoH5N9JRP;5;narrow_left;satisfaction_is;1;26;2: female;NA;-1;At the moment we are unsure if she has both - only Gludon levels. Therefore I swayed more towards the first option.;;1;;;;
5YBdqyNSMLhW;5;narrow_left;satisfaction_is;1;63;2: female;None;0;Both mutations increase the Gludron levels , only the Mut TAW4 increases Lian. Both mutations occur with an equal incidence;1;;;;;
zOnYGpBNRp6q;5;narrow_left;satisfaction_is;1;68;2: female;NA;0;according to the info at the beginning there is an equal chance of the patient having either mutation present so I went 50%;1;;;;;
XLvadNL25MBB;5;narrow_left;satisfaction_is;1;36;1: male;NA;0;We know that both mutations change the Gludon levels in the bloodstream, and that both mutations have equal chance of appearing in a random person, so by finding that the person has abnormal levels of Gludon and with this and only this information we can say that the chances of either mutation appearing are equal.;1;;;;;
EaQVwPyfOIWY;5;narrow_left;satisfaction_is;1;32;2: female;NA;0;the prevelance is equal and we dont know the chance of the other abnormal level;1;;;;;
VykoC4oXSnEb;5;narrow_left;satisfaction_is;2;27;2: female;NA;0;Both mutations are equally likely to occur in a person;1;;;;;
hQVAliGfY3jw;5;narrow_left;satisfaction_is;1;23;2: female;no errors;0;As the chances of both are equally as likely to occur, the fact that the patient has gludon there is an equal chance they have lian ;1;;;;;
VAY3KePOBn4K;5;narrow_left;satisfaction_is;1;35;1: male;NA;-1;The initial data leans one way but the fact that both elements typically coexist in someone means it cannot be ruled out completely. ;;1;;;;
FoVabfc6y2J7;5;narrow_left;satisfaction_is;1;27;1: male;None;0;Both conditions are equally as likely to occur in a person. ;1;;;;;
4EmzVSGRJtiQ;5;narrow_left;satisfaction_is;1;29;1: male;NA;4;i believe the patient has abnormal Gludon blood levels, because there is still a chance he or she has abnormal liam blood levels. So there is a higher chance its Abnormal Gludon blood levels;;1;;;;
3tLX9Gm81DcG;5;narrow_left;satisfaction_is;1;27;1: male;NA;0;Abnormal gludon is caused by 2 and 4. But abnormal lian is only caused by 4. Therefore, without knowing the lian level, the patient could have either condition. ;1;;;;;
zhceRdv3515P;5;narrow_left;satisfaction_is;1;76;2: female;None;0;Both seem to have the same effect, so it's just a name.;;1;;;;
RcjITlTOftsZ;5;narrow_left;satisfaction_is;1;24;2: female;NA;0;There hasn't been a test done as to their Lian levels, and as we know that both mutations occur equally then the likelihood of them having either mutation is the same at this point. ;1;;;;;
ZQdVkJgjbmtu;5;narrow_left;satisfaction_is;1;54;1: male;None;0;Previously it was stated that both conditions are equally likely. The difference is the Lian blood level but we do not have the results for that test yet. ;1;;;;;
Xcm9M0Wn2egD;5;narrow_left;satisfaction_is;1;59;1: male;NA;0;You are just not sure on the levels of each mutation;;1;;;;
ZFBtrnLDAuSt;5;narrow_left;satisfaction_is;2;30;1: male;none;0;At the moment it is definitely the first one but could be the second one, we just don't know yet.;;1;;;;
ykzRdCgMFPxk;5;narrow_left;satisfaction_is;1;22;1: male;n/a;3;As it was said it was equally likely to occur in a person both Mut-Bic2 and Mut-Taw4 meaning that if the person has confirmed higher gludon levels they are likely to have higher Lian blood levels as well;;1;;;;
6TwNfSE9JMm5;5;narrow_left;satisfaction_is;1;23;1: male;N/A;-1;As it is unknown whether they have low lian levels it is more likely to just be the first mutation, but not impossible to be the second one;;1;;;;
CESTUyCoTVXg;5;narrow_left;satisfaction_is;2;77;1: male;no errors;0;The patient definitely has both Mut-Bic22 and Mic-Taw4 because both are equally likely occur to a person. ;;1;;;;
08fIEWNuJSKl;5;narrow_left;satisfaction_is;1;28;1: male;NA;0;We have not yet got the result of the Lian levels;1;;;;;
ewK7xzq9E0Wh;5;narrow_left;satisfaction_is;1;26;2: female;none;4;If the results come back that there are abnormal Lian blood levels then the patient can only have Mut-Taw4. Because Mut-Taw2 only causes abnormal Gludon blood levels.;1;;;;;
ot3jjftFjGCR;5;narrow_left;satisfaction_is;1;40;1: male;NA;3;the likelihood they can have both;;1;;;;
xtAlTZDh3c2P;5;narrow_left;satisfaction_is;1;28;2: female;NA;0;Without knowing the Lian levels there is no way to know which it is;1;;;;;
G4W3VbQjfiBt;5;narrow_left;satisfaction_is;2;26;1: male;NA;0;Gludon levels can be attributed to either Muts. ;1;;;;;
OdjTx40wNSFU;5;narrow_left;satisfaction_is;1;27;1: male;None;0;there's nothing to indicate they also have abnormal Lian levels + the alterations are equally likely to occur in a person. Thus I'm neither here nor there.;1;;;;;
qIDMwVkUOMpl;5;narrow_left;satisfaction_is;1;55;2: female;NA;-2;The Gludon blood levels in the person indicate Mut-Bic2,but as the Lian levels are not yet known,it is slightly more likely at this stage to be the first gene mutation, even taking into consideration the fact that the same number of people in the general poulation is the same in both mutations.;;1;;;;
3rd2qK0snRiP;5;narrow_left;satisfaction_is;2;24;1: male;NA;0;The context earlier mentioned that both of the are equally likely to occur so even if Taw4 hasnt been identified yet theres still a likely chance it may occur ;1;;;;;
iBUxbHHTXKtj;5;narrow_left;satisfaction_is;1;28;2: female;No errors.;0;Both cause a level of abnormal Gludon blood levels, but without information on other blood levels, there's no clear cause.;1;;;;;
YrdYl8G2WRKD;5;narrow_left;satisfaction_is;1;25;1: male;NA;0;Because the two mutations deals with blood and equally attack human. There's a tendency that the man will be suffering from both.;;1;;;;
5OBGimO3AUPG;5;narrow_left;satisfaction_is;1;30;1: male;NA;0;Not sure. They both occur at the same rate. If the patient has elevated levels of the first one, it is equally likely they will have elevated levels of the second. It was the best answer I could come up with.;1;;;;;
auO7toxsKDej;5;narrow_left;satisfaction_is;1;33;2: female;NA;0;Both mutations equally prevalent;1;;;;;
FT09tY56WQdl;5;narrow_left;satisfaction_is;2;54;1: male;NA;4;GIVEN THAT BOTH MUTATIONS OCCUR IN EQUAL POPULATION, THERE IS A POSSIBILITY THAT THE PATIENT SUFFERS FROM BOTH MUTATIONS;;1;;;;
uB9FMQ1roTl9;5;narrow_left;satisfaction_is;1;35;2: female;None;-5;This one definitely makes the levels higher.;;1;;;;
gUxkje4qNUZN;5;narrow_left;satisfaction_is;1;42;2: female;No errors;0;As the patient already has changed Gludon levels, the chance of them having Mut Bic 2 or Mut Taw 4 are equally the same.;;1;;;;
ni0OQvVyWmNp;5;narrow_left;satisfaction_is;1;65;2: female;No problems;0;Both mutations affect gludon levels and both are just as prevalent in the population so it is equally likely to be either mutation ;1;;;;;
9pz3eRUy2drM;5;narrow_left;satisfaction_is;1;56;1: male;NA;-5;It would be better if the patient had this mutant, since then the patient would only have one condition.;;;1;;;
A9VxdpyUDx5C;5;narrow_left;satisfaction_is;1;29;2: female;nop;0;i think i've made a wrong choice, i should've choosen Tic2 more likely, instead of having both Gludon and Lian...;;1;;;;
9uRN8LtfpA8Z;5;narrow_left;satisfaction_is;1;38;1: male;NA;0;The patient has abnormal Gludon levels which are prevalent in both mutations. As both mutations have the same probability of occuring in the patient, suffice to say that the chances of it being either mutation will have equal probability.;1;;;;;
6MRo4ipg4TMR;5;narrow_left;satisfaction_is;1;26;1: male;NA;0;Don't know about one of the indicators, so it can still be either one;1;;;;;
TKO0VoHVXEyr;5;narrow_left;satisfaction_is;1;41;1: male;NA;0;Until the patient is tested for lidan blood levels one can only assume that its a equal possibility that it can be either or mutation. ;1;;;;;
Ew9RYeGwhFeB;5;narrow_left;satisfaction_is;2;48;1: male;NA;2;Genetic mutations have been known to play a significant role in various biological processes and can have a profound impact on an individual's health. Understanding the relationship between gene mutations and the composition of blood substances is crucial for advancing medical knowledge. ;;1;;;;
cfwjol0yaF93;5;narrow_left;satisfaction_is;1;33;2: female;N/A;-3;mut-Bic2 always causes abnormal gludon blood level if it was mut-taw4 it should have indicated strains of lian blood levels along with gludon blood level;;;;;1;
A9efOY1ODqAc;5;narrow_left;satisfaction_is;1;59;1: male;No errors encountered. ;0;I believe both are satisfying because they are likely to occur in one person. ;;1;;;;
qdPPEOzKvmfb;5;narrow_left;satisfaction_is;1;52;1: male;NA;0;We need to test Lian levels as this is the key indicator between the two;1;;;;;
ALq80tdZ08lu;5;narrow_left;satisfaction_is;1;34;1: male;NA;0;Could actually be either one, because the only symptom verified appears under both cases.;1;;;;;
uXLFZiY6gu5w;5;narrow_left;satisfaction_is;1;25;2: female;NA;0;Both raise that type of blood level and are equally contagious so unless you do further tests there is no way of knowing which is more likely.;1;;;;;
rkNVmCBlCshh;5;narrow_left;satisfaction_is;1;43;2: female;it is difficult to know if they are spelling errors as gludon and lian are both made up.;0;as we have not tested the lian levels it is not possible to make any assessment using this measurement. Since both mutations cause an effect on the gludon levels and they are both equally likely to occur then with this information there is not difference in the chance of either mutation being the cause and therefore they are equally satisfying.;1;;;;;
Hu8JJrNIaq3k;5;narrow_left;satisfaction_is;1;45;2: female;NA;0;Both cause abnormal gludon levels and both are as likely to occur as each other. We don't yet know about lian levels;1;;;;;
krRSKOlCG3ot;5;narrow_left;satisfaction_is;1;44;1: male;No errors that I noticed.;0;Both mutations affect Gludon levels, and we were told both are equally likely to occur in the population. So in a patient with increased Gludon levels, both of the mutations are equally plausible as the cause, without any further information to work with such as Lian levels.;1;;;;;
LYE7z09hwgo7;5;narrow_left;satisfaction_is;1;48;2: female;none;-3;I chose the first option because the second one, for it to be plausible, would have already had to have shown instances of the mutuation.;;1;;;;
FUvwNP8GBoqk;5;narrow_left;satisfaction_is;1;24;2: female;NA;4;cos that mutation its what causes abnormal lian levels;;1;;;;
oVxjpLGWi7ce;5;narrow_left;satisfaction_is;1;31;2: female;I did not encounter any errors in the study. The study is well put together, easy to understand, and enjoyable. Thank you!;0;Both gene mutations are equally likely to be the cause to this persons condition. Since it is not yet known if they have abnormal Lian blood levels, then both mutations could be the cause. ;1;;;;;
VUDuMhPC6ZXW;5;narrow_left;satisfaction_is;2;44;2: female;no errors;0;we know that they have Bic2 but as they have not been tested for Taw4 we cannot be sure if they have it yet.;;1;;;;
IQSlDGD1G4u4;5;narrow_left;satisfaction_is;2;30;1: male;NA;-1;Having one rather than both would be more satisfying.;;;1;;;
6cY5UeNJPMe7;5;narrow_left;satisfaction_is;1;34;2: female;NA;0;Both have equal chances of occuring as stated in the beginning, both affect Gludon so that doesn't narrow the chances down;1;;;;;
MncuLNC2Or6E;5;narrow_left;satisfaction_is;2;42;1: male;NA;-2;Because there is only a 5% chance of the person having  Mut-taw4 it is more probable that they dont have it then do.;;;;1;;
HUULWSejWP49;5;narrow_left;satisfaction_is;3;29;1: male;N/A;0;Not enough information is supplied about the physiological effects of the conditions, nor existing affects / conditions of the patient to choose a well informed evaluation.;1;;;;;
TJDbLWD8cKEe;5;narrow_left;satisfaction_is;1;23;1: male;NA;3;as the life expectancy can be affected by both the mutation.;;1;;;;
eJGE3wxGD6Sf;5;narrow_left;satisfaction_is;1;35;2: female;None;0;From what I understood from the initial reading the chance of having one or the other is equal, so until we know if what the Lidon result for the patient are it is difficult for me to determine which gene mutation they potentially have.;1;;;;;
DSKvy1adN4Pd;5;narrow_left;satisfaction_is;2;28;1: male;No;0;Made sense to me as equal;;1;;;;
SLeBZhPH3zGg;5;narrow_left;satisfaction_is;2;33;2: female;NA;-2;we know they have abnormal gludon levels but dont know the levels of lian yet;;1;;;;
2fknEzA3nyUu;5;narrow_left;satisfaction_is;1;23;2: female;NA;0;since lian hasnt been inspected there is a 50/50 chance;1;;;;;
fwoQwl6tUcRH;5;narrow_left;satisfaction_is;3;34;1: male;NA;0;I'm basing this on the fact that they can occur equally.;1;;;;;
2BXYrs9BXyhp;5;narrow_left;satisfaction_is;1;33;1: male;None;1;The hypothesis is clear in my desirable choice which points to the efficacy of the defect and how its disastrous effects could ported a serious problem for human existence.;;;1;;;
Bd3fgnIE9LLf;5;narrow_left;satisfaction_is;2;28;1: male;NA;-2;it states he already has it. although the study found it is equally likely to have both only a small % were found to have it;;1;;;;
TQUxa1PovcQS;5;narrow_left;satisfaction_is;1;23;1: male;no error;2;"Certainly! My rating was based on the information provided in the scenario and the limitations of the data presented. Here's a brief explanation of my rating:
The scenario provided specific details about two gene mutations, Mut-Bic2 and Mut-Taw4, along with their effects on blood levels (i.e., Mut-Bic2 causes abnormal Gludon blood levels, and Mut-Taw4 causes abnormal Gludon and abnormal Lian blood levels). It also mentioned that 10 out of 200 participants in a study had abnormal Lian blood levels (5%).
However, there was no information given about Patient #53's blood levels, genetic test results, or any other individual-specific data. Without this critical information, it is impossible to determine which mutation is the most satisfying explanation for Patient #53's physiological condition.
Therefore, my rating indicates that the scenario did not provide sufficient details to draw a conclusion about Patient #53's specific condition and its association with either Mut-Bic2 or Mut-Taw4. Additional data would be required to make an informed assessment of Patient #53's case.";;1;;;;
2sazPXbnR9ny;5;narrow_left;satisfaction_is;1;21;2: female;NA;0;The patient could have either of the mutations and that a test to see if there are abnormal Luan levels will be able to solidify which one they have.;1;;;;;
mSUJHkmkB9H7;5;narrow_left;satisfaction_is;1;56;2: female;none;0;WE just don't know if they have the second gene causing the lian deficiency so at the moment it could be either the first or second causing the condition.;1;;;;;
vRPexNCpDtmx;5;narrow_left;satisfaction_is;1;46;2: female;NA;0;We know the patient has abnormal Gludon levels, yet his Lian levels are not known. Without knowing his Lian levels, either gene mutation is a possibility.;1;;;;;
bWlYFJ7gpWqz;5;narrow_left;satisfaction_is;1;27;1: male;none;0;We dont have enough data to say which one it is;1;;;;;
z69R8O45tb3j;5;narrow_left;satisfaction_is;1;45;2: female;NA;0;Both mutations can cause the same but without knowing the lian result it's impossible to speculate which mutation the patient may have.;1;;;;;
C2ZDJANZ7jPk;5;narrow_left;satisfaction_is;1;20;1: male;No issues;0;Since the previous information stated that the mutations were equally likely, I went along with that logic and went down the middle;1;;;;;
1wrtq5zjhsmM;5;narrow_left;satisfaction_is;1;62;2: female;Hello there, no technical errors. The layout was fine, there were no spelling errors or other errors that were noticeable. Thank you, kind regards, ;-5;The person concerned definitely showed abnormal Gludon blood levels, but had yet to be tested for abnormal Lian blood levels. ;;1;;;;
kVNHo29vRcJl;5;narrow_left;satisfaction_is;1;48;2: female;NA;0;both mutations occur equally in all populations ;1;;;;;
Sbsanpky0Zxt;6;narrow_right;satisfaction_is;1;47;1: male;NA;0;Gludon is affected by both mutations;1;;;;;
f8tEWv5PXsVx;6;narrow_right;satisfaction_is;3;35;1: male;NA;-2;"We definitely know there is one mutation so that covers one type.
The unknown mutation is what drives the outcome so much. ";;1;;;;
tMX70mlxwb2S;6;narrow_right;satisfaction_is;1;54;2: female;no;0;The number of people that have either or are about the same.;1;;;;;
NKW15TatTp51;6;narrow_right;satisfaction_is;1;35;1: male;NA;0;the patient already has one sympton which is found in both strains, but there is no way to know if he has the other strain found in only one of them so its equally likely for both.;1;;;;;
AqPD5wd6Ud9d;6;narrow_right;satisfaction_is;1;20;2: female;NA;0;i was not sure exactly what was meant by satisfying by i rated middle as they were both equally plausable;1;;;;;
CANIhNfB1YQP;6;narrow_right;satisfaction_is;3;41;2: female;NA;0;Because both cause abnormal gludon levels which the person has;1;;;;;
lu1WqMOuIrWQ;6;narrow_right;satisfaction_is;1;47;2: female;Far too ridiculously complicated for someone to remember the details, I had to take a screen shot to get your verification questions correct;0;Both of them cause the same symptom that has already been found and both have the same incidence in the community.;1;;;;;
vPuiOX9IGpc6;6;narrow_right;satisfaction_is;1;22;1: male;NA;0;All you currently know is that they have abnormal gludon levels, and both the TAW4  and BIC2 mutations are equally likely to occur, therefore without knowing the Lian levels, it's impossible to say which, assuming it's not both, has occured- and again they're equally likely to occur.;1;;;;;
YxaXVxPO9Y5H;6;narrow_right;satisfaction_is;1;52;1: male;NA;0;Both are equally occurring in the population, and both affect Gludon levels, therefore either could be present with equal probability in this patient.;1;;;;;
B0Et5ke7jXe3;6;narrow_right;satisfaction_is;2;63;2: female;NA;0;Each mutation occurs with same frequency in the population. ;1;;;;;
N7BKyr3ZQ8ia;6;narrow_right;satisfaction_is;1;48;1: male;Nil;5;Mut-Taw4 consists of two unit changers and Bic-2 has only one level to change;;1;;;;
tss3QuvfV0Wg;6;narrow_right;satisfaction_is;1;51;2: female;NA;-1;it was hard but I used the fact that it definitely corresponded to one mutation and worked from there;;1;;;;
crgnFEyUBXi2;6;narrow_right;satisfaction_is;1;24;1: male;NA;0;I gave this rating since both mutations are equally likely to have or not have the extra mutatuion.;;1;;;;
wzLN5U2Cp3ZJ;6;narrow_right;satisfaction_is;1;38;1: male;None;0;If we don't know about Lian blood levels we cannot really determine which is more likely.;1;;;;;
RqMS3LQLWf7k;6;narrow_right;satisfaction_is;3;37;1: male;N/A;0;The two disorders occur equally in the population, which is why I came to the conclusion that I did.;1;;;;;
6pLNtqK0ppn8;6;narrow_right;satisfaction_is;1;22;1: male;None;0;The mutations are just as prevalent as each other and the patient is showing signs that it could be either of them and so it is just as likely to be either of them at the moment or even both.;1;;;;;
nP2ZcHJ9DcY6;6;narrow_right;satisfaction_is;2;47;2: female;NA;0;because it was equally the same;1;;;;;
VUMrFM8hEP9F;6;narrow_right;satisfaction_is;2;55;1: male;None noticed.;0;Both mutations can cause this abnormal blood result so we have no evidence yet for one or the other. ;1;;;;;
4yUyOe52Vwlt;6;narrow_right;satisfaction_is;1;70;2: female;Everything looked fine thanks;0;I am not entirely sure from the information I was given but I don't remember being told that the abnormal Lian levels caused further damage.;;1;;;;
4PXYDvYq754Y;6;narrow_right;satisfaction_is;2;38;1: male;NA;0;Unknown second situation;;1;;;;
qCO9t0OJ6riv;6;narrow_right;satisfaction_is;1;50;2: female;NA;0;We only knew about the Gludon blood levels so we couldn't tell which mutation the patient had. Both mutations are equally common (10 in 200) so without the Lian numbers the chance is 50/50 as to which mutation they had. ;1;;;;;
s5AclAS4TJ9o;6;narrow_right;satisfaction_is;1;36;2: female;I did not encounter any errors in terms of technical issues and I am not aware of any other errors either;0;If it is known that patient 53 has abnormal gludon blood levels, but we are yet to find out about lian levels, it stands to reason that since both mutations are equally likely to occur in a person that there is a 50:50 chance that the person could have either Mut-Tae4 or Mut-Bic2 gene mutation;1;;;;;
69eivDbKbGV6;6;narrow_right;satisfaction_is;1;46;2: female;na;0;well he already has the abnormality so even if he has both blood mutations it makes no differenc to having just the one i think;;;1;;;
uz6zlILjKr79;6;narrow_right;satisfaction_is;1;39;1: male;NA;0;Gludon levels are regulated equally by both mutations;1;;;;;
UzWkip4lcSyH;6;narrow_right;satisfaction_is;1;47;2: female;All good.;0;Both have an equal chance of appearing in the population - though 5% are susceptible.;1;;;;;
